{
  "theme": "fresh",
  "ideas": [
    {
      "id": "FRI1",
      "name": "셀프캡 카드",
      "one_liner": "고객이 직접 정한 월 예산을 카드 이용한도로 걸 수 있고, 예산 안에서 한 달을 마치면 다음 달 기본 적립이 올라가는 '브레이크가 달린' 신용카드.",
      "novelty_type": ["혜택 구조", "접근 방식"],
      "what_is_new": "가장 가까운 처음(ANNIVERSE)의 공식 혜택 문구는 '소비관리 보너스: 목표 입력 500P, 달성 5천P, 일시불 당월 즉시결제 0.3% 추가(월 최대 1만P)'다. 앱에 목표 숫자를 넣고 나중에 보상하는 방식이다. 이 컨셉은 (1) 고객이 정한 월 예산을 실제 카드 월 이용한도(하드캡)로 걸 수 있게 하고, (2) 예산 80%·100% 도달 시점에 알림을 보내며, (3) 전월 '이용금액'이 아니라 전월 '예산 지킴 여부'로 다음 달 적립률을 정한다. 토스뱅크 하나카드 WIDE('전월 실적과 상관없이 1%', '전월 실적 40만 원 이상 2%')처럼 많이 쓸수록 혜택이 커지는 50종의 일반 구조와 방향이 반대다.",
      "nearest_cards": [
        {"card": "처음(ANNIVERSE)", "similarity": "소비 목표를 설정하고 달성하면 포인트를 준다", "difference": "처음은 목표 입력·달성 시 고정 포인트(월 최대 1만P)를 사후에 주고, 한도를 막거나 적립률을 바꾸지 않는다. 셀프캡은 예산을 승인 한도로 걸 수 있고, 지킨 달에는 다음 달 전체 적립률이 바뀐다"},
        {"card": "토스뱅크 하나카드 WIDE", "similarity": "실적 무관 기본률 위에 상위 구간이 있는 2단 구조", "difference": "WIDE는 전월 40만원 이상 쓰면 상위 구간으로 올라가고, 셀프캡은 스스로 정한 예산을 넘지 않으면 상위 구간으로 올라간다"},
        {"card": "카카오뱅크 줍줍 신한카드", "similarity": "전월 실적 조건 없는 기본 적립", "difference": "줍줍은 이용을 제한하는 장치 없이 최대 2%(월 4만원)를 준다"}
      ],
      "target": "첫 신용카드를 쓰는 20대 초중반, 간편결제를 쓴 뒤 지출이 늘었다고 느끼는 사람",
      "why_genz": "MZ세대는 카드를 잘 쓰는 데 필요한 요소로 소비 통제(한도 설정·가계부)를 64.4%, 혜택 설계를 19.2% 꼽았다(CSF5). 간편결제 후 소비 경계심이 줄었다는 응답이 56.8%, 소비가 늘었다는 응답이 51.3%다(MHF39, MHF40, 전 연령). 결제일 부담 경험 53.6%(CSF3), 리볼빙 비이용 의향 88.0%(CSF6). Z세대 71.6%가 절약·저축에 관심이 있다(MHF1).",
      "concept": {
        "offer": "내가 정한 예산이 실제로 지켜지는 카드, 그리고 예산을 지킨 달에 붙는 더 높은 적립",
        "mechanism": [
          "대상: 카드 회원 본인. 매월 말일까지 다음 달 예산을 1만원 단위로 정하고, '하드캡(예산을 월 이용한도로 적용)'과 '소프트캡(알림만)' 중 하나를 고른다.",
          "알림: 이용금액이 예산의 80%와 100%에 이르면 앱 푸시를 보낸다. 하드캡이면 예산을 넘는 승인은 거절되고, 앱에서 그 달 1회 예산을 올릴 수 있다. 올리면 그 달은 '예산 지킴'으로 인정하지 않는다.",
          "적립: 전월 실적과 무관하게 국내외 가맹점 기본 0.7% 포인트. 전월에 예산을 지켰으면 다음 달 1.2%를 적용하고, 월 적립 한도를 둔다.",
          "예산 지킴 판정: 설정 예산이 직전 3개월 평균 이용액 이하일 때만 인정해 예산을 크게 잡아 보너스를 받는 우회를 막는다.",
          "고지: 할부는 승인 시점 전액이 예산에 들어가고, 교통 후불 등 예외 결제가 하드캡에 걸릴 수 있다는 점을 발급 화면에 적는다."
        ],
        "performance_rule": {"type": "behavior", "description": "전월 이용금액 구간 대신 '전월 예산 지킴 여부'가 상위 적립 조건이다. 실적을 채우려고 더 쓸 이유가 없다."},
        "growth_path": null,
        "design_values": [
          {"what": "기본 적립률(실적 무관)", "value": "0.7%", "design_value": true},
          {"what": "예산 지킴 달 다음 달 적립률", "value": "1.2%", "design_value": true},
          {"what": "월 적립 한도", "value": "1만P", "design_value": true},
          {"what": "알림 시점", "value": "예산의 80%, 100%", "design_value": true},
          {"what": "연회비", "value": "1만원", "design_value": true}
        ]
      },
      "evidence_ids": ["CSF5", "CSF3", "CSF6", "MHF39", "MHF40", "MHF41", "MHF1", "WTF38", "WTF43", "PFF11"],
      "evidence_note": "근거가 말하는 것: 통제 욕구(CSF5)와 간편결제 후 경계심 약화(MHF39·MHF40), 재단 관계자의 예산 초과 알림 도입 제언(MHF41). 말하지 않는 것: CSF5의 64.4%는 가계부와 한도 설정을 한 문항으로 묶은 MZ 단위 값이라 한도 기능 단독 수요가 아니다. MHF39·MHF40은 전 연령이다. 예산을 지킨 보상이 카드 선택 이유가 되는지 묻는 근거는 없다.",
      "new_tags": [
        {"key": "self_budget_cap", "label": "자기 설정 예산 한도", "definition": "고객이 정한 월 예산을 카드 이용한도나 알림 기준으로 적용한다"},
        {"key": "budget_keep_bonus", "label": "예산 지킴 가산", "definition": "전월 예산을 넘지 않은 경우 다음 달 적립률을 올린다"}
      ],
      "need_key": "control",
      "domain_key": null,
      "platform_hook": "소비 통제가 혜택 설계보다 3배 넘게 꼽혔는데(CSF5), 50종 중 통제를 혜택 조건으로 쓴 카드는 처음(ANNIVERSE)의 사후 보너스 1종뿐이다.",
      "durability": "지속 추세",
      "risks": [
        "수익성: 혜택 재원은 가맹점수수료 적격비용 중 부가서비스 비용과 연회비에 묶여 있다(PFF35, PFF38). 고객 이용액을 줄이는 상품이라 수수료 수입과 부딪힌다. 가산분(0.5%p)은 연회비와 월 적립 한도로 묶어야 한다.",
        "악용: 예산을 넉넉히 잡으면 늘 '지킴'이 되므로 직전 3개월 평균 이하 조건 같은 판정 기준이 필요하다. 조건이 까다로우면 통제형 고객이 이탈한다.",
        "복제 용이성: 알림·한도는 앱 기능이라 경쟁사가 쉽게 따라 한다(verify_risk의 CTC1 지적). 차별점은 '적립률이 예산 지킴에 걸린다'는 약관상 구조에 둔다.",
        "운영: 하드캡이 교통·정기결제 승인을 막으면 불편 민원이 생긴다. 예외 업종 목록이 필요하다.",
        "규제: 부가서비스는 의무유지기간이 있어(STF69 3년, PFF42 과거 보도 1년+6개월 전 통보) 적립률을 쉽게 내리기 어렵다. 현행 조문은 이번에 확인하지 못했다."
      ],
      "open_questions": [
        "가상 고객이 하드캡을 고르는가, 알림만 고르는가?",
        "예산 지킴 보상(0.5%p)이 없어도 알림만으로 발급 의향이 같은가? 보상이 의향을 바꾸는가?",
        "월 예산을 직접 정하는 일을 20대가 귀찮아하지 않는가? 직전 달 기준 자동 제안이 필요한가?",
        "고객이 요청할 때 이용한도를 낮추는 일반 기능이 있다고 알려져 있으나 이번 근거 팩에서는 확인하지 않았다. 월 단위로 바꾸는 운영이 가능한가?"
      ],
      "interpretation_flags": [
        "해석: 통제 욕구를 혜택 조건으로 바꾸면 '많이 쓸수록 이득'이라는 카드 공식이 뒤집힌다",
        "해석: 예산 지킴 보상이 연회비로 감당 가능하다는 판단",
        "durability '지속 추세'는 절약 관심(MHF1, WTF43)과 무지출 언급 증가(WTF38)에 기댄 해석"
      ]
    },
    {
      "id": "FRI2",
      "name": "구독 슬롯 카드",
      "one_liner": "고객이 고른 정기결제 3개(슬롯)만 할인하고, 이 카드로 나가는 모든 구독을 장부로 모아 결제 예정·중복·금액 인상을 먼저 알려주는 카드.",
      "novelty_type": ["혜택 구조", "접근 방식"],
      "what_is_new": "NEED Pay의 공식 문구는 '넷플릭스·유튜브·디즈니플러스·티빙·웨이브·스포티파이, 네이버플러스·컬리멤버스·배민클럽 정기결제 30% 할인(건당 3,000원, 월 통합 5,000원, 인앱·단건결제 제외)'이고, zgm.streaming은 '멤버십 이용요금 할인 건별 최대 7,000원'과 '스트리밍 월 통합 5,000원'이다. 둘 다 카드사가 정한 고정 목록을 할인한다. 이 컨셉은 (1) 목록 대신 고객이 매월 바꾸는 슬롯 3개를 주고(생성형 AI 구독처럼 목록에 없던 것도 들어갈 수 있다), (2) 할인보다 '구독 장부'(다음 결제 예정 알림, 같은 종류 구독 중복 알림, 직전 결제 대비 금액 변동 알림, 구독 예산)를 핵심 경험으로 둔다. 구독 일시정지·해지 대행은 가맹점 권한이라 약속하지 않는다(verify_risk의 CTC4 교정 반영). 참고로 브리프는 AI 구독 할인 카드가 DB 밖에서 이미 시판 중이라고 적었다(카카오뱅크 착붙 신한카드 ChatGPT·Claude 10%). 그래서 새로운 점은 AI 할인이 아니라 슬롯과 장부의 결합이다.",
      "nearest_cards": [
        {"card": "NEED Pay", "similarity": "OTT·멤버십 정기결제 할인", "difference": "NEED Pay는 대상 목록이 고정이고 월 통합 5,000원이며 관리 기능 문구가 없다. 슬롯 카드는 고객이 대상을 고르고 장부·예정 알림이 붙는다"},
        {"card": "zgm.streaming", "similarity": "멤버십·스트리밍 구독 할인", "difference": "zgm.streaming은 가맹점별 월 1회 고정 할인이고 전월 40만원 조건이며, 구독 총액을 관리하는 장치가 없다"},
        {"card": "처음(ANNIVERSE)", "similarity": "정기결제(멤버십 20%, OTT 15%, 통신 10%) 적립", "difference": "처음은 업종 단위 적립이고 고객이 대상을 고르거나 구독 묶음을 관리하는 구조가 아니다"}
      ],
      "target": "OTT·쇼핑 멤버십·생성형 AI 등 구독을 3개 이상 쓰는 20대",
      "why_genz": "20대 유료 OTT 이용률 83.6%로 전 연령 최고(TRF11), 20~30대가 가장 다양한 카테고리를 유료 구독한다(TRF13). 20대가 새로 쓰고 싶은 구독 1위가 생성형 AI(23.0%)다(WTF7). 구독 예산을 따로 정하지 않는 응답 67.2%(MHF25), 구독 단점으로 '월정액 관리 부족으로 인한 낭비' 77.4%(WTF9). 부담되면 해지 대신 계정 공유·일시정지·연간 결제로 버틴다(MHF24).",
      "concept": {
        "offer": "내가 고른 구독 3개 할인과 '내 구독이 지금 얼마인지' 한눈에 보는 장부",
        "mechanism": [
          "대상: 이 카드로 결제되는 정기결제 가맹점. 고객이 그중 3개를 슬롯으로 지정하고, 매월 말일까지 다음 달 슬롯을 바꿀 수 있다.",
          "혜택: 슬롯 정기결제 20% 청구할인, 슬롯당 월 3,000원, 월 통합 9,000원 한도. 전월 이용실적 20만원 이상일 때 적용한다.",
          "장부: 승인 데이터로 정기결제를 추정해 월 합계, 구독 예산 대비 비율, 다음 결제 예정일 3일 전 알림, 같은 카테고리 2개 이상 중복 알림, 직전 결제보다 금액이 오르면 알림을 준다.",
          "고지: 정기결제 판별은 승인 내역 기반 추정이다. 앱마켓 인앱결제는 가맹점이 앱마켓으로 잡혀 슬롯 지정이 제한될 수 있다. 해지·일시정지는 각 서비스에서 해야 한다."
        ],
        "performance_rule": {"type": "spend", "description": "슬롯 할인만 낮은 전월 실적(20만원)에 묶고, 장부·알림은 실적과 무관하게 모두에게 준다."},
        "growth_path": null,
        "design_values": [
          {"what": "슬롯 수", "value": "3개", "design_value": true},
          {"what": "슬롯 할인율", "value": "20% 청구할인", "design_value": true},
          {"what": "한도", "value": "슬롯당 월 3,000원, 월 통합 9,000원", "design_value": true},
          {"what": "전월 실적", "value": "20만원", "design_value": true},
          {"what": "결제 예정 알림", "value": "결제 예정일 3일 전", "design_value": true}
        ]
      },
      "evidence_ids": ["TRF10", "TRF11", "TRF13", "WTF7", "WTF8", "WTF9", "MHF22", "MHF23", "MHF24", "MHF25"],
      "evidence_note": "근거가 말하는 것: 20대 구독 이용이 넓고(TRF11, TRF13), 생성형 AI 구독이 늘며(MHF22, WTF7), 구독 관리 부족을 단점으로 느낀다(WTF9). 말하지 않는 것: WTF9·MHF25·MHF24는 전 연령(20~59세 등) 값이다. 구독 장부 기능 때문에 카드를 고르겠다는 근거는 없다.",
      "new_tags": [
        {"key": "subscription_slot", "label": "구독 슬롯 선택 할인", "definition": "고객이 직접 지정한 정기결제 몇 개에만 할인을 적용하고, 매월 바꿀 수 있다"},
        {"key": "subscription_ledger", "label": "구독 장부·결제 예정 알림", "definition": "카드로 나가는 정기결제를 모아 합계·예정일·중복·금액 변동을 알린다"}
      ],
      "need_key": "fixed_cost",
      "domain_key": "sub",
      "platform_hook": "50종의 구독 혜택은 모두 카드사가 정한 고정 목록 할인이고, 관리 부족 낭비 77.4%(WTF9)에 답하는 구조는 없다.",
      "durability": "지속 추세",
      "risks": [
        "운영: 정기결제를 승인 데이터로 판별하면 오류가 생기고, 인앱결제는 가맹점 식별이 어렵다(NEED Pay도 인앱 제외).",
        "수익성: 구독은 건당 금액이 작아 할인 비용 대비 가맹점수수료 수입이 작다. 할인 재원은 적격비용·연회비에 묶인다(PFF35, PFF38).",
        "이해상충: 중복 알림이 해지로 이어지면 구독 제휴사와의 관계, 카드 이용액 감소와 부딪힌다.",
        "개인정보: 정기결제 내역 분석에 이용 동의가 필요할 수 있다(이번 근거에서 확인하지 못함).",
        "약속 금지: 일시정지·해지 대행은 가맹점 권한이라 상품 약속으로 쓰면 안 된다(verify_risk의 CTC4 교정)."
      ],
      "open_questions": [
        "가상 고객이 슬롯 할인(최대 9,000원)과 장부 알림 중 어느 쪽 때문에 발급하려 하는가?",
        "슬롯 3개가 20대 평균 구독 개수에 맞는가? WTF8의 1인당 3~4개는 전 연령 값이다.",
        "결제 예정 알림이 무료 체험 후 첫 결제를 잡을 수 있는가? 첫 결제는 이력이 없어 예측이 안 된다."
      ],
      "interpretation_flags": [
        "해석: 구독 피로는 할인보다 '보이게 하는 것'으로 풀린다는 가정",
        "해석: 슬롯 상한이 사실상 구독 예산 역할을 한다는 주장"
      ]
    },
    {
      "id": "FRI3",
      "name": "정산 선결제 카드(총무 모드)",
      "one_liner": "모임 비용을 이 신용카드로 먼저 낸 사람이 앱에서 정산 요청을 보내면, 친구들이 보낸 돈으로 그 결제 건이 자동 선결제되고 정산을 끝낸 건에는 캐시백이 붙는 카드.",
      "novelty_type": ["혜택 구조", "영역"],
      "what_is_new": "카카오뱅크 줍줍 신한카드의 공식 문구 '승인 후 5일 이내 선결제 시 추가 캐시백 1%를 월 최대 2만원'과 디지로카 London의 '일시불 이용 후 5영업일 이내 즉시결제 시 추가 캐시백 1%'는 고객 본인이 자기 돈으로 선결제할 때 보상한다. 이 컨셉은 선결제 재원이 '모임원의 정산 입금'이다. 결제 건마다 정산 요청을 보내고, 입금되면 그 건에 자동 선결제하고, 정산이 끝난 건에만 캐시백을 준다. 청구는 총무 1인 명의로 그대로 둔다. 모임원별 분할 청구(SOC1 원안)는 명의자 단위 심사(STF24)와 연체 책임 문제로 넣지 않았다. 카카오뱅크 모임 체크카드(GTF17, DB 밖)는 모임통장 잔액에서 바로 빠지는 체크 구조다. 이 카드는 통장을 미리 만들지 않은 즉석 모임에서 '먼저 긁은 사람'의 결제일 부담을 겨냥한다.",
      "nearest_cards": [
        {"card": "카카오뱅크 줍줍 신한카드", "similarity": "선결제 시 추가 캐시백, 은행 앱에서 즉시결제", "difference": "줍줍은 본인 선결제 보상이고 모임원 정산과 연결되지 않는다"},
        {"card": "디지로카 London", "similarity": "즉시결제 1% 캐시백, 무이자 분할납부(LOCA 나누기)", "difference": "London은 본인 결제 주기를 조정한다. 총무 모드는 남의 몫을 받아 해당 건을 지운다"},
        {"card": "토스뱅크 체크카드", "similarity": "20대가 많이 쓰는 인터넷은행 카드", "difference": "체크카드라 선결제 부담이 없고 모임 정산 구조도 없다"}
      ],
      "target": "동아리·친구 모임·여행에서 먼저 결제하고 나중에 돈을 받는 '총무' 역할의 20대",
      "why_genz": "카카오뱅크 모임통장 순이용자 1,200만(GTF6), 모임 체크카드 100만장(GTF10)으로 모임 결제 수요는 크지만 체크카드·통장으로 풀렸다. 20대는 카카오톡을 송금·결제에 51.4% 쓴다(MHF10). 배민이 앱 안에 더치페이를 넣었다(GTF22). MZ 53.6%가 결제일 부담을 느꼈다(CSF3).",
      "concept": {